category,keyword,level
business,negotiation leverage in high-stakes deals,beginner
business,building trust with strategic partners,beginner
business,decision-making under uncertainty,intermediate
money,cash flow discipline for operators,beginner
money,debt reduction without sacrificing growth,intermediate
money,allocating capital for asymmetric upside,advanced
power,personal presence in leadership rooms,beginner
power,influence without visible authority,intermediate
power,managing perception in competitive environments,advanced
grooming,executive grooming for camera and stage,beginner
grooming,wardrobe signals that reinforce authority,intermediate
grooming,daily rituals that compound confidence,beginner
others,mental resilience during market volatility,beginner
others,time architecture for high-output weeks,intermediate
others,ethical boundaries when pursuing power,advanced
